{
  "schema_version": "2",
  "artifact_type": "plan",
  "plan": {
    "id": "FS0-CORE-PLAN",
    "title": "FS0-Core Implementation Plan",
    "description": "FS0-Core irreducible runtime kernel for one complete subsequent functionality-defined functional-set cycle. It implements only Design addressing/revision resolution, functional-set loading, stable normative identity and applicability, closed modular Plan loading, bounded Build execution, basic Conformance, governed semantic Assurance, minimum authority/lineage, explicit acceptance, and successor-cycle self-hosting."
  },
  "functional_set": {
    "id": "FS0-CORE",
    "path": "repo/planning/000_FS0-CORE/functional-set.json"
  },
  "implementation_predecessor": {
    "repository_revision": "7e64e7fe600ded62153ad4b5e009ce03bba1ba41"
  },
  "documents": {
    "requirements": "requirements.json",
    "file_plans": [
      "files/001-repo-runtime-repo_spec-init-py.json",
      "files/002-repo-runtime-repo_spec-errors.py.json",
      "files/003-repo-runtime-repo_spec-jsonio.py.json",
      "files/004-repo-runtime-repo_spec-design.py.json",
      "files/005-repo-runtime-repo_spec-functional_set.py.json",
      "files/006-repo-runtime-repo_spec-normative.py.json",
      "files/007-repo-runtime-repo_spec-plan.py.json",
      "files/008-repo-runtime-repo_spec-assurance.py.json",
      "files/009-repo-runtime-repo_spec-conformance.py.json",
      "files/010-repo-runtime-repo_spec-build.py.json",
      "files/011-repo-runtime-repo_spec-governance.py.json",
      "files/012-repo-runtime-repo_spec-cli.py.json",
      "files/013-repo-runtime-repo_spec-__main__.py.json",
      "files/014-repo-planning-assurance-report.schema.json.json",
      "files/015-repo-planning-acceptance.schema.json.json",
      "files/016-repo-tests-fs0_core-test_design.py.json",
      "files/017-repo-tests-fs0_core-test_planning.py.json",
      "files/018-repo-tests-fs0_core-test_build_governance.py.json",
      "files/019-repo-runtime-repo_spec-repository.py.json",
      "files/020-repo-planning-conformance-report.schema.json.json",
      "files/021-repo-planning-build-manifest.schema.json.json"
    ],
    "execution": "execution.json",
    "invariants": "invariants.json",
    "validation": "validation.json",
    "completion": "completion.json"
  }
}
